{
  "schema": "receipt.witness_observation.v0_1",
  "receipt_digest": "sha256:cd39fb5019b44fecda66b39fcc561ad4ba0449a519d633d51586d5156254c269",
  "witness_node_id": "node:witness-c",
  "observed_at": "2026-08-23T05:00:09Z",
  "signature": {
    "algorithm": "ed25519",
    "key_id": "node:witness-c:key-1",
    "value": "5a7dda3e5c1ea1d00b24b37ee6df3e17cd0c975d7b7efeac594e65e6634bf8c4"
  }
}
